policy_id,name,year_recommended,source,status,implementing_body,budget_allocated_ksh_m,budget_utilized_pct,blocking_factor,lives_saved_estimate,notes
P001,Nzoia Upper Basin Management,2016,WRA / Trans Nzoia County,Partially Implemented,Water Resources Authority,180.0,22.0,Cross-county coordination across Bungoma and Kakamega,140,"Nzoia River drains Mt Elgon and Cherangany Hills. Upper basin management requires coordination across Trans Nzoia, Bungoma, and Kakamega counties. Joint basin committee established 2019. Decisions are advisory only."
P002,Mount Elgon Catchment Reforestation,2015,Kenya Forest Service,Partially Implemented,Kenya Forest Service,95.0,41.0,Smallholder encroachment on forest boundary,110,"15000 ha reforestation target. 6200 ha planted as of 2023. Catchment degradation continues to increase flood peak flows into Nzoia. Community forest associations active in 8 sub-locations."
P003,Kitale Town Stormwater Upgrade,2019,Trans Nzoia County,Stalled,Trans Nzoia County,145.0,0.0,Budget re-allocated to road works 2021 and 2022,75,"Design complete. County prioritised road works over drainage. Main collectors on Kenyatta St and Hospital Rd remain undersized for 10-year storm. CBD floods annually."
P004,Cherangany Hills Landslide-Flood Risk Mapping,2021,NDMA,Completed,NDMA / Trans Nzoia County,28.0,100.0,Not integrated into county planning approvals,85,"Risk map completed 2022. High-risk corridors identified in Saboti and Kiminini. County planning department has not incorporated map into development approval process."
P005,Nzoia River Cross-Border Flood Protocol,2020,IGAD / Kenya,Draft Only,Ministry of Water,0.0,0.0,Uganda upstream water management not coordinated,60,"Protocol to coordinate flood releases from Ugandan catchment areas. Draft shared with Ugandan counterparts 2021. Not ratified. Upstream deforestation in eastern Uganda driving increasing flood peaks."
